{
  "schema": "lifeorch.model_registry/0.1",
  "_comment": "FIXTURE base registry for ops/setup off-box gen tests. Mirrors the load-bearing shape of modules/07-model-gateway/models.json (a subset). NOT the live registry.",
  "updated_utc": "2026-07-28T00:00:00.0000000Z",
  "host": "FIXTURE-HOST",
  "engine_build": "llama.cpp b8661 (fixture)",
  "engines": {
    "llama-server": "F:\\My_Programs\\LifeOrchestrator-Refresh_Large_Data\\_engines\\llama.cpp\\bin\\llama-server.exe"
  },
  "defaults": { "llm": "llm.weak.qwen2p5-1p5b" },
  "tiers": {
    "llm": {
      "tiny": "llm.weak.qwen2p5-0p5b",
      "weak": "llm.weak.qwen2p5-1p5b",
      "mid": "llm.weak.qwen2p5-3b",
      "strong": "llm.strong.qwen3p5-9b"
    }
  },
  "models": [
    {
      "model_id": "llm.strong.qwen3p5-9b",
      "type": "llm", "wired": true,
      "name": "Qwen3.5-9B", "family": "qwen3.5", "format": "gguf", "quant": "Q5_K_M",
      "version": "Qwen_Qwen3.5-9B-Q5_K_M",
      "path": "F:\\My_Programs\\LifeOrchestrator-Refresh_Large_Data\\07-model-gateway\\llm\\Qwen3.5-9B-Q5_K_M\\Qwen_Qwen3.5-9B-Q5_K_M.gguf",
      "engine": "llama-server",
      "engine_path": "F:\\My_Programs\\LifeOrchestrator-Refresh_Large_Data\\_engines\\llama.cpp-b10092\\bin\\llama-server.exe",
      "context": 8192, "gpu_layers": 99,
      "params": { "params_b": 9, "size_bytes": 7111487520, "sha256": "a686d88ec1e6881f9bf161526826cd6d6874b7f0e80e0f79acf6144a132c5d7e" }
    },
    {
      "model_id": "llm.strong.qwen3p5-9b-q4",
      "type": "llm", "wired": false,
      "name": "Qwen3.5-9B", "family": "qwen3.5", "format": "gguf", "quant": "Q4_K_M",
      "version": "Qwen_Qwen3.5-9B-Q4_K_M",
      "path": "F:\\My_Programs\\LifeOrchestrator-Refresh_Large_Data\\07-model-gateway\\llm\\Qwen3.5-9B-Q4_K_M\\Qwen_Qwen3.5-9B-Q4_K_M.gguf",
      "engine": "llama-server",
      "engine_path": "F:\\My_Programs\\LifeOrchestrator-Refresh_Large_Data\\_engines\\llama.cpp-b10092\\bin\\llama-server.exe",
      "context": 8192, "gpu_layers": 99,
      "params": { "params_b": 9, "size_bytes": 6169341984, "sha256": "d784ce9eda1a5a7b51e8f705a9e6310844bf4f173654d115823c775fdea56d43" }
    },
    {
      "model_id": "llm.weak.qwen2p5-1p5b",
      "type": "llm", "wired": true,
      "name": "Qwen2.5-1.5B-Instruct", "family": "qwen2.5", "format": "gguf", "quant": "Q4_K_M",
      "version": "Qwen2.5-1.5B-Instruct-Q4_K_M",
      "path": "F:\\My_Programs\\LifeOrchestrator-Refresh_Large_Data\\07-model-gateway\\llm\\Qwen2.5-1.5B-Instruct-Q4_K_M\\Qwen2.5-1.5B-Instruct-Q4_K_M.gguf",
      "engine": "llama-server",
      "context": 4096, "gpu_layers": 99,
      "params": { "params_b": 1.5, "size_bytes": 986048768 }
    },
    {
      "model_id": "llm.weak.qwen2p5-3b",
      "type": "llm", "wired": true,
      "name": "Qwen2.5-3B-Instruct", "family": "qwen2.5", "format": "gguf", "quant": "IQ4_XS",
      "version": "Qwen2.5-3B-Instruct-IQ4_XS",
      "path": "F:\\My_Programs\\LifeOrchestrator-Refresh_Large_Data\\07-model-gateway\\llm\\Qwen2.5-3B-Instruct-IQ4_XS\\Qwen2.5-3B-Instruct-IQ4_XS.gguf",
      "engine": "llama-server",
      "context": 4096, "gpu_layers": 99,
      "params": { "params_b": 3, "size_bytes": 1739095200 }
    },
    {
      "model_id": "vlm.qwen2p5-vl-3b",
      "type": "vlm", "wired": false,
      "name": "Qwen2.5-VL-3B-Instruct (GGUF)", "family": "qwen2.5-vl", "format": "gguf", "quant": "Q4_K_M",
      "version": "Qwen2.5-VL-3B-Instruct-Q4_K_M",
      "path": "F:\\My_Programs\\LifeOrchestrator-Refresh_Large_Data\\17-image-interpret\\vlm\\Qwen2.5-VL-3B-Instruct-GGUF\\Qwen2.5-VL-3B-Instruct-Q4_K_M.gguf",
      "mmproj": "F:\\My_Programs\\LifeOrchestrator-Refresh_Large_Data\\17-image-interpret\\vlm\\Qwen2.5-VL-3B-Instruct-GGUF\\mmproj-Qwen2.5-VL-3B-Instruct-f16.gguf",
      "engine": "llama-server",
      "context": 8192, "gpu_layers": 99,
      "params": { "params_b": 3, "size_bytes": 1929901056, "sha256": "d02fe9b69ad8cadbbd228e387667af66612c44bed29ffc8eb1e7caf9ac486c12", "mmproj_sha256": "b9160fe9d814d1fadf68395677468534778b39ac33c2e7561b7b218626e60d5e" }
    },
    {
      "model_id": "image.sd15",
      "type": "image-gen", "wired": false,
      "name": "Stable Diffusion 1.5 (diffusers fp16)", "family": "stable-diffusion", "format": "diffusers", "quant": "fp16",
      "path": "F:\\My_Programs\\LifeOrchestrator-Refresh_Large_Data\\23-gen-image\\stable-diffusion-v1-5",
      "engine": "diffusers",
      "engine_env": "F:\\My_Programs\\Local_Computer_Speech_Large_Data\\python_env\\Scripts\\python.exe",
      "params": { "variant": "fp16", "size_bytes": 2134194467 }
    },
    {
      "model_id": "ocr.windows.media",
      "type": "ocr", "wired": false,
      "name": "Windows.Media.Ocr (system)", "family": "windows.media.ocr", "format": "system-winrt",
      "path": null,
      "engine": "windows.media.ocr",
      "engine_env": "C:\\WINDOWS\\System32\\WindowsPowerShell\\v1.0\\powershell.exe",
      "params": { "max_image_dimension": 10000 }
    },
    {
      "model_id": "ocr.tesseract",
      "type": "ocr", "wired": false,
      "name": "Tesseract OCR", "family": "tesseract", "format": "executable",
      "path": "C:\\Program Files\\Tesseract-OCR\\tesseract.exe",
      "engine": "tesseract",
      "classes": null,
      "params": {}
    }
  ]
}
